{
  "sessionId": "6b548daa-4e4a-4d4f-a32e-f0fbeb5c0694",
  "taskId": "test-task",
  "startTime": "2026-02-14T19:24:57.499Z",
  "status": "completed",
  "events": [
    {
      "timestamp": "2026-02-14T19:24:57.787Z",
      "type": "log",
      "author": "user",
      "content": "First log entry"
    }
  ],
  "endTime": "2026-02-14T19:24:58.574Z"
}